{
  "meta": {
    "schema_version": "1.0.0",
    "config_root": "use_cases/configs",
    "artifacts_root": "artifacts",
    "adapter": "ui/adapter/build_view_model.py",
    "runtime": {
      "mode": "latest_artifacts",
      "backend_executed": false,
      "execution_scope": "none",
      "executed_use_cases": [],
      "run_ids": {},
      "infra_profile": "local",
      "seed": 101,
      "runtime_mode": "default",
      "scenario_id": null,
      "failure_injection": [],
      "output_dir": "artifacts",
      "strict_model_backends": false,
      "executed_at_utc": null
    },
    "warnings": [],
    "scenario_library": [
      {
        "scenario_id": "churn_support_surge",
        "use_case_id": "UC-CHURN-RET-002",
        "title": "Churn Support Surge",
        "description": "Simulates rising support burden and engagement decline to show churn intervention prioritization.",
        "default_seed": 222,
        "failure_injection": []
      },
      {
        "scenario_id": "incrementality_negative_lift",
        "use_case_id": "UC-INCR-MKT-004",
        "title": "Incrementality Negative Lift",
        "description": "Introduces campaigns with weaker treated conversion outcomes to demonstrate scale/pause/retest decisions.",
        "default_seed": 444,
        "failure_injection": []
      },
      {
        "scenario_id": "mmm_budget_rebalance",
        "use_case_id": "UC-MMM-PLN-003",
        "title": "MMM Budget Rebalance",
        "description": "Shifts channel spend mix so technical users can inspect response changes and optimization recommendations.",
        "default_seed": 333,
        "failure_injection": []
      },
      {
        "scenario_id": "nba_dq_failure_demo",
        "use_case_id": "UC-NBA-RET-001",
        "title": "NBA DQ Failure Demo",
        "description": "For governance walkthroughs: injects data-quality gate failure.",
        "default_seed": 515,
        "failure_injection": [
          "dq_fail"
        ]
      },
      {
        "scenario_id": "nba_high_risk_save",
        "use_case_id": "UC-NBA-RET-001",
        "title": "NBA High-Risk Save",
        "description": "Pushes risk scores upward and contact pressure upward to explain retention rescue actioning.",
        "default_seed": 111,
        "failure_injection": []
      }
    ]
  },
  "platform_flow": [
    {
      "order": 1,
      "layer_id": "data_sources",
      "label": "Data Sources",
      "upstream": [
        "Business Systems",
        "Channel Signals",
        "Experiment Logs"
      ],
      "downstream": [
        "Ingestion + Event Bus"
      ],
      "business_summary": "Collects first-party customer and campaign signals required for decisions.",
      "technical_summary": "Contract-aware source generation and connector abstraction for repeatable ingestion.",
      "components": {
        "current": [
          "Python source generators"
        ],
        "oss_profile": [
          "Kafka producer inputs (via adapter)",
          "File-based local fallback"
        ],
        "scalable_swap_ins": [
          "Airbyte",
          "Kafka Connect",
          "Debezium"
        ]
      }
    },
    {
      "order": 2,
      "layer_id": "ingestion_event_bus",
      "label": "Ingestion + Event Bus",
      "upstream": [
        "Data Sources"
      ],
      "downstream": [
        "Raw Storage + Curated Warehouse"
      ],
      "business_summary": "Creates a reliable event trail so decisions are explainable and replayable.",
      "technical_summary": "Canonical topic naming, append-only events, and deterministic artifact persistence.",
      "components": {
        "current": [
          "In-memory LocalEventBus",
          "JSONL topic artifacts"
        ],
        "oss_profile": [
          "Apache Kafka"
        ],
        "scalable_swap_ins": [
          "Apache Kafka",
          "Redpanda",
          "Apache Pulsar"
        ]
      }
    },
    {
      "order": 3,
      "layer_id": "raw_curated_storage",
      "label": "Raw Storage + Curated Warehouse",
      "upstream": [
        "Ingestion + Event Bus"
      ],
      "downstream": [
        "Identity Resolution + Customer 360"
      ],
      "business_summary": "Preserves immutable evidence and creates analytics-ready curated data.",
      "technical_summary": "Stores raw event logs and curated joins in JSON/JSONL with warehouse mirroring options.",
      "components": {
        "current": [
          "Local artifact files (JSON/JSONL)"
        ],
        "oss_profile": [
          "PostgreSQL mirror",
          "MinIO snapshots"
        ],
        "scalable_swap_ins": [
          "PostgreSQL",
          "ClickHouse",
          "MinIO",
          "Apache Iceberg"
        ]
      }
    },
    {
      "order": 4,
      "layer_id": "identity_customer_360",
      "label": "Identity Resolution + Customer 360",
      "upstream": [
        "Raw Storage + Curated Warehouse"
      ],
      "downstream": [
        "Feature Layer"
      ],
      "business_summary": "Unifies customer records so targeting and measurement use a single customer truth.",
      "technical_summary": "Deterministic unified IDs and household keys for person-level use cases.",
      "components": {
        "current": [
          "Deterministic identity mapper"
        ],
        "oss_profile": [
          "Local mapping artifacts"
        ],
        "scalable_swap_ins": [
          "Splink",
          "DuckDB",
          "Record linkage workflows"
        ]
      }
    },
    {
      "order": 5,
      "layer_id": "feature_layer",
      "label": "Feature Layer",
      "upstream": [
        "Identity Resolution + Customer 360"
      ],
      "downstream": [
        "Model Layer"
      ],
      "business_summary": "Transforms raw behavior into measurable business signals used by models.",
      "technical_summary": "Use-case-specific feature projections persisted as model-ready rows.",
      "components": {
        "current": [
          "Python feature builders"
        ],
        "oss_profile": [
          "Artifact-backed feature rows"
        ],
        "scalable_swap_ins": [
          "dbt",
          "Feast",
          "DuckDB"
        ]
      }
    },
    {
      "order": 6,
      "layer_id": "model_layer",
      "label": "Model Layer (MMM, Incrementality, Attribution, Experimentation)",
      "upstream": [
        "Feature Layer"
      ],
      "downstream": [
        "Serving + Activation"
      ],
      "business_summary": "Generates recommendations and causal insights to optimize marketing outcomes.",
      "technical_summary": "Pluggable model registry validates outputs against contract fields.",
      "components": {
        "current": [
          "Use-case model modules",
          "Output schema validator"
        ],
        "oss_profile": [
          "Local model execution",
          "OSS data sinks for all use cases"
        ],
        "scalable_swap_ins": [
          "MLflow",
          "Airflow",
          "PyMC",
          "EconML"
        ]
      }
    },
    {
      "order": 7,
      "layer_id": "serving_activation",
      "label": "Serving + Activation",
      "upstream": [
        "Model Layer (MMM, Incrementality, Attribution, Experimentation)"
      ],
      "downstream": [
        "Monitoring + Governance"
      ],
      "business_summary": "Turns model output into actions that campaign systems can execute.",
      "technical_summary": "Use-case payload adapters map model rows into destination contracts.",
      "components": {
        "current": [
          "Python payload adapters",
          "Activation artifacts"
        ],
        "oss_profile": [
          "File-backed payload delivery"
        ],
        "scalable_swap_ins": [
          "FastAPI",
          "BentoML",
          "Webhook connectors"
        ]
      }
    },
    {
      "order": 8,
      "layer_id": "monitoring_governance",
      "label": "Monitoring + Governance",
      "upstream": [
        "Serving + Activation"
      ],
      "downstream": [
        "Feedback to Data Sources and Model Layer"
      ],
      "business_summary": "Maintains trust through validation gates, alerts, and deployment readiness checks.",
      "technical_summary": "Contract coverage checks, gate results, and run-status reporting.",
      "components": {
        "current": [
          "Validation gate evaluator",
          "Run report artifacts"
        ],
        "oss_profile": [
          "Local governance reports"
        ],
        "scalable_swap_ins": [
          "Great Expectations",
          "Evidently",
          "Prometheus",
          "Grafana"
        ]
      }
    }
  ],
  "portfolio_snapshot": {
    "use_cases_total": 4,
    "use_cases_with_runs": 4,
    "latest_runs_pass": 4,
    "latest_runs_fail": 0,
    "total_latest_curated_rows": 338
  },
  "use_cases": [
    {
      "use_case_id": "UC-CHURN-RET-002",
      "name": "Churn Prediction and Retention Actioning",
      "primary_kpi": "60_day_incremental_churn_reduction",
      "business_problem": "High-risk customers are not identified early enough for effective retention intervention.",
      "business_outcome": "Reduce avoidable churn by prioritizing high-risk segments with action recommendations.",
      "contract": {
        "baseline": 0.12,
        "target": 0.102,
        "entities": [
          "customer",
          "transaction",
          "event",
          "support_case",
          "consent"
        ],
        "features": [
          "tenure_days",
          "recency_days",
          "frequency_60d",
          "monetary_90d",
          "support_tickets_30d",
          "complaint_count_30d",
          "campaign_response_rate_90d"
        ],
        "output_type": "score_and_recommendation",
        "output_fields": [
          "customer_id",
          "churn_risk_score",
          "risk_band",
          "recommended_action",
          "expected_uplift",
          "reason_codes",
          "score_ts",
          "model_version"
        ],